{
  "$schema"      : "../multistep-schema.json",
  "name"         : "Ab3",
  "description"  : "Order-3 Adams-Bashforth formula, newest derivative first.",
  "kind"         : "linear-multistep",
  "order"        : 3,
  "alpha"        : ["1", "-1", "0", "0"],
  "beta"         : ["0", "23.0 / 12.0", "-16.0 / 12.0", "5.0 / 12.0"]
}
